results/maquina_1/disputa_recursos.csv

service,cpu_percent,mem_mb
Nginx (Load Balancer),26.93,13.77
WordPress (wordpress1),287.95,1138.69
WordPress (wordpress2),269.57,510.8
WordPress (wordpress3),267.85,564.1
MySQL (Banco),115.67,890.6
redis,0.3,8.29
Locust (Gerador de Carga),48.5,95.0

README.md

#### Análise do Consumo sob Carga Máxima (Medido com `docker stats`):

* **Instâncias WordPress (`wordpress1..3`):** Consumiram combinadas cerca de **825% de CPU** (~270% a 288% por nó PHP/Apache) e **2.2 GB de memória RAM**, sendo os componentes mais intensivos em processamento.
* **MySQL (`mysql`):** Consumiu **115.7% de CPU** e **890 MB de RAM** processando consultas simultâneas de post e sessões.
* **Nginx (`nginx`):** Consumiu apenas **26.9% de CPU** e **13.8 MB de RAM**, provando a altíssima eficiência de um proxy assíncrono baseado em *event loop*.
* **Locust (`locust`):** Consumiu **48.5% de CPU** e **95.0 MB de RAM**.
  > **Conclusão Técnica sobre o Requisito 3:** O contêiner do Locust consumiu sozinho quase meio núcleo inteiro de CPU para gerar os usuários concorrentes. Em máquinas com menor quantidade de núcleos físicos, essa disputa do Locust tira processamento vital do Apache e do MySQL, reduzindo artificialmente a capacidade máxima medida do cluster.